Fonte;Título;Link
Canal Rural;CLIMA NOS PRÓXIMOS DIASFrente fria e temperaturas entre 2°C e 40°C devem marcar a semana Previsão do tempo indica calor escaldante em parte da Região Norte em pleno inverno. No Sul e Sudeste, termômetros baixam de vez;https://www.canalrural.com.br/tempo/frente-fria-e-temperaturas-entre-2c-e-40c-devem-marcar-a-semana/
Canal Rural;ANÁLISE DA SEMANAAlta oferta derruba arroba do boi, mas exportação evita tombo maior Passagem de uma frente fria em estados-chave para a pecuária nacional fez disponibilidade de animais aumentar e frigoríficos avançarem nas escalas;https://www.canalrural.com.br/pecuaria/alta-oferta-derruba-arroba-do-boi-mas-exportacao-evita-tombo-maior/
Canal Rural;SEGURANÇA JURÍDICAGoverno assina acordo para acelerar regularização fundiária de 1,9 milhão de hectares Área equivale a 7% do território do Tocantins que atualmente pertence à União;https://www.canalrural.com.br/agricultura/governo-assina-acordo-para-acelerar-regularizacao-fundiaria-de-19-milhao-de-hectares/
Canal Rural;CURIOSIDADETudo começou com uma galinha! Filme brasileiro é eleito o 15º melhor do século Lançado em 2002, Cidade de Deus foi reconhecido por um júri de mais de 500 especialistas em cinema como uma das 100 maiores obras da sétima arte;https://www.canalrural.com.br/entretenimento/tudo-comecou-com-uma-galinha-filme-brasileiro-e-eleito-o-15o-melhor-do-seculo/
Canal Rural;ORIENTE MÉDIOConflitos pressionam economia, mas inflação global deve ser limitada Economista avalia que confronto entre Irã e Israel pressiona o petróleo, mas risco de inflação global segue baixo. Para o Brasil, impacto é indireto;https://www.canalrural.com.br/economia/conflitos-pressionam-economia-mas-inflacao-global-deve-ser-limitada/
Globo Rural;Quarta frente fria começa amanhã e julho abre com risco de geada no Sul;https://globorural.globo.com/previsao-do-tempo/noticia/2025/06/julho-comeca-com-nova-frente-fria-risco-de-geada-e-termometro-abaixo-de-zero-no-sul.ghtml
Globo Rural;Parceria com BNDES levanta R$ 299 milhões a agricultura familiar na Bahia;https://globorural.globo.com/agricultura-familiar/noticia/2025/06/parceria-com-bndes-levanta-r-299-milhoes-a-agricultura-familiar-na-bahia.ghtml
Globo Rural;Livro brasileiro sobre cachaça conquista prêmios no “Oscar da Gastronomia”;https://globorural.globo.com/cultura/noticia/2025/06/livro-brasileiro-sobre-cachaa-conquista-prmios-no-oscar-da-gastronomia.ghtml
Globo Rural;Acre inaugura maior complexo de café da agricultura familiar da região Norte;https://globorural.globo.com/agricultura/cafe/noticia/2025/06/acre-inaugura-maior-complexo-de-cafe-da-agricultura-familiar-da-regiao-norte.ghtml
Globo Rural;Estudante cria bandejas biodegradáveis com casca de mandioca e galhos de araucária;https://globorural.globo.com/sustentabilidade/noticia/2025/06/estudante-cria-bandejas-biodegradaveis-com-casca-de-mandioca-e-galhos-de-araucaria.ghtml
Globo Rural;Agricultura não é vilã e sim parte da solução dos desafios climáticos, diz diretor do IICA;https://globorural.globo.com/especiais/um-so-planeta/noticia/2025/06/agricultura-nao-e-vila-e-sim-parte-da-solucao-dos-desafios-climaticos-diz-diretor-do-iica.ghtml
Globo Rural;Empresa de máquinas agrícolas espera aumento de 10% nos recursos do Plano Safra da agricultura familiar;https://globorural.globo.com/credito-e-investimento/noticia/2025/06/empresa-de-maquinas-agricolas-espera-aumento-de-10percent-nos-recursos-do-plano-safra-da-agricultura-familiar.ghtml
Globo Rural;Pão com farinha de insetos? Pesquisa no México cria alimento mais proteico;https://globorural.globo.com/cultura/noticia/2025/06/pao-com-farinha-de-insetos-pesquisa-no-mexico-cria-alimento-mais-proteico.ghtml
Globo Rural;Jovem pesquisa combate aos efeitos do clima em plantas de soja;https://globorural.globo.com/tecnologia-e-inovacao/noticia/2025/06/jovem-pesquisa-combate-aos-efeitos-do-clima-em-plantas-de-soja.ghtml
Globo Rural;Como fazer frango teriyaki;https://globorural.globo.com/vida-na-fazenda/receitas/noticia/2025/06/como-fazer-frango-teriyaki.ghtml
AgroLink;Transportadores “comemoram” suspensão do reajuste de IOF;https://www.agrolink.com.br/noticias/transportadores--comemoram--suspensao-do-reajuste-de-iof_503411.html
AgroLink;Guaíba pode voltar à cota de inundação no domingo (29);https://www.agrolink.com.br/noticias/guaiba-pode-voltar-a-cota-de-inundacao-no-domingo--29---alerta-iph-ufrgs_503410.html
AgroLink;SP amplia acesso a crédito rural para compra de tratores;https://www.agrolink.com.br/noticias/sao-paulo-amplia-acesso-a-credito-rural-para-compra-de-tratores_503409.html
AgroLink;Produção de mel sofre perdas com o inverno gaúcho;https://www.agrolink.com.br/noticias/producao-de-mel-sofre-perdas-com-o-inverno-gaucho_503407.html
AgroLink;Lavouras de trigo têm bom desempenho no Paraná;https://www.agrolink.com.br/noticias/lavouras-de-trigo-tem-bom-desempenho-no-parana_503406.html
Canal Rural;CLIMA NOS PRÓXIMOS DIASFrente fria e temperaturas entre 2°C e 40°C devem marcar a semana Previsão do tempo indica calor escaldante em parte da Região Norte em pleno inverno. No Sul e Sudeste, termômetros baixam de vez;https://www.canalrural.com.br/tempo/frente-fria-e-temperaturas-entre-2c-e-40c-devem-marcar-a-semana/
Canal Rural;ANÁLISE DA SEMANAAlta oferta derruba arroba do boi, mas exportação evita tombo maior Passagem de uma frente fria em estados-chave para a pecuária nacional fez disponibilidade de animais aumentar e frigoríficos avançarem nas escalas;https://www.canalrural.com.br/pecuaria/alta-oferta-derruba-arroba-do-boi-mas-exportacao-evita-tombo-maior/
Canal Rural;SEGURANÇA JURÍDICAGoverno assina acordo para acelerar regularização fundiária de 1,9 milhão de hectares Área equivale a 7% do território do Tocantins que atualmente pertence à União;https://www.canalrural.com.br/agricultura/governo-assina-acordo-para-acelerar-regularizacao-fundiaria-de-19-milhao-de-hectares/
Canal Rural;CURIOSIDADETudo começou com uma galinha! Filme brasileiro é eleito o 15º melhor do século Lançado em 2002, Cidade de Deus foi reconhecido por um júri de mais de 500 especialistas em cinema como uma das 100 maiores obras da sétima arte;https://www.canalrural.com.br/entretenimento/tudo-comecou-com-uma-galinha-filme-brasileiro-e-eleito-o-15o-melhor-do-seculo/
Canal Rural;ORIENTE MÉDIOConflitos pressionam economia, mas inflação global deve ser limitada Economista avalia que confronto entre Irã e Israel pressiona o petróleo, mas risco de inflação global segue baixo. Para o Brasil, impacto é indireto;https://www.canalrural.com.br/economia/conflitos-pressionam-economia-mas-inflacao-global-deve-ser-limitada/
Canal Rural;QUINTA-FEIRA Soja: saiba como ficaram as cotações no Brasil em meio à oscilação registrada Movimentação nos portos e retenção por parte dos produtores marcaram o dia;https://www.canalrural.com.br/agricultura/projeto-soja-brasil/soja-saiba-como-ficaram-as-cotacoes-no-brasil/
Canal Rural;PECUÁRIA DE PONTA!Nelore precoce surpreende em MS com quase 22 arrobas no pasto Boiada “com carinha de menino” impressiona com peso e acabamento de qualidade na Fazenda São Roque, em Porto Murtinho (MS). Assista ao vídeo;https://www.canalrural.com.br/pecuaria/nelore-precoce-surpreende-em-ms-com-quase-22-arrobas-no-pasto/
Canal Rural;NA TVTransforme sua propriedade em um destino turístico Quer saber como receber turistas, oferecer experiências autênticas e ainda vender seus produtos direto da roça? Acesse aqui e confira!;https://www.canalrural.com.br/empreendedorismo/transforme-sua-propriedade-em-um-destino-turistico/
Canal Rural;"PREPARE-SEOnda de frio enfraquece, mas ainda tem geada e temporais; veja previsão do tempo para esta sexta Massa de ar polar se despede com mínimas abaixo de 4 °C no Sul, enquanto áreas do Norte e Nordeste entram em alerta para chuvas fortes";https://www.canalrural.com.br/tempo/onda-de-frio-enfraquece-mas-ainda-tem-geada-e-temporais-veja-previsao-do-tempo-para-esta-sexta/
Canal Rural;EXCEÇÃO Tocantins ganha destaque na produção de sementes de soja fora do calendário tradicional Cultivo fora de época garante sementes de qualidade e movimenta a economia no estado;https://www.canalrural.com.br/agricultura/projeto-soja-brasil/tocantins-ganha-destaque-na-producao-de-sementes-de-soja-fora-do-calendario-tradicional/
